{"fact_id":"I-1:fact:1","fact_type":"AMOUNT","raw_value":"40,000 EUR","normalized_value":"40000","source":{"source_id":"raw-input","start":0,"end":10,"content_hash":"sha256:aaaaaaaaaaaaaaaaaaaaaaaaaaaaaaaaaaaaaaaaaaaaaaaaaaaaaaaaaaaaaaaa"},"method":"deterministic-quote","method_version":"0.3.0","extraction_confidence":0.99,"verification_status":"UNRESOLVED","confirmation_required":true}
